{
  "contractId": "spts.agent-structured-result",
  "schemaVersion": "2.0.0",
  "resultId": "result-verifier",
  "resultDigest": "0000000000000000000000000000000000000000000000000000000000000000",
  "packetId": "packet-verifier",
  "packetDigest": "0000000000000000000000000000000000000000000000000000000000000000",
  "projectId": "SPTS",
  "taskId": "SPTS-10",
  "repositoryId": "scrum-pi-team-skills",
  "runId": "run-2",
  "baseBranch": "main",
  "baseCommit": "aaaaaaaaaaaaaaaaaaaaaaaaaaaaaaaaaaaaaaaa",
  "baseTree": "bbbbbbbbbbbbbbbbbbbbbbbbbbbbbbbbbbbbbbbb",
  "headBranch": "feature/spts-10",
  "candidateCommit": "cccccccccccccccccccccccccccccccccccccccc",
  "candidateTree": "dddddddddddddddddddddddddddddddddddddddd",
  "role": "independent-verifier",
  "actorId": "verifier-1",
  "executionId": "exec-verifier",
  "workspaceId": "workspace-verifier",
  "access": "read-only",
  "assurance": "critical",
  "authorityDigest": "aaaaaaaaaaaaaaaaaaaaaaaaaaaaaaaaaaaaaaaaaaaaaaaaaaaaaaaaaaaaaaaa",
  "controllerStateDigest": "bbbbbbbbbbbbbbbbbbbbbbbbbbbbbbbbbbbbbbbbbbbbbbbbbbbbbbbbbbbbbbbb",
  "status": "approved",
  "payload": {
    "kind": "independent-verifier",
    "outcomeCode": "verified",
    "subjectDigest": "cccccccccccccccccccccccccccccccccccccccccccccccccccccccccccccccc",
    "axes": [
      { "axis": "correctness", "verdict": "approve", "findingCodes": [] }
    ]
  }
}
