{
  "contractId": "spts.agent-structured-result",
  "schemaVersion": "2.0.0",
  "resultId": "result-flow",
  "resultDigest": "0000000000000000000000000000000000000000000000000000000000000000",
  "packetId": "packet-flow",
  "packetDigest": "0000000000000000000000000000000000000000000000000000000000000000",
  "projectId": "SPTS",
  "taskId": "SPTS-10",
  "repositoryId": "scrum-pi-team-skills",
  "runId": "run-2",
  "baseBranch": "main",
  "baseCommit": "aaaaaaaaaaaaaaaaaaaaaaaaaaaaaaaaaaaaaaaa",
  "baseTree": "bbbbbbbbbbbbbbbbbbbbbbbbbbbbbbbbbbbbbbbb",
  "headBranch": "feature/spts-10",
  "candidateCommit": "cccccccccccccccccccccccccccccccccccccccc",
  "candidateTree": "dddddddddddddddddddddddddddddddddddddddd",
  "role": "flow",
  "actorId": "flow-1",
  "executionId": "exec-flow",
  "workspaceId": "workspace-flow",
  "access": "orchestrate",
  "assurance": "standard",
  "authorityDigest": "aaaaaaaaaaaaaaaaaaaaaaaaaaaaaaaaaaaaaaaaaaaaaaaaaaaaaaaaaaaaaaaa",
  "controllerStateDigest": "bbbbbbbbbbbbbbbbbbbbbbbbbbbbbbbbbbbbbbbbbbbbbbbbbbbbbbbbbbbbbbbb",
  "status": "accepted",
  "payload": {
    "kind": "flow",
    "outcomeCode": "review-approved",
    "reviewedDigest": "cccccccccccccccccccccccccccccccccccccccccccccccccccccccccccccccc",
    "findings": []
  }
}
