{
  "contractId": "spts.agent-structured-result",
  "schemaVersion": "2.0.0",
  "resultId": "result-product",
  "resultDigest": "0000000000000000000000000000000000000000000000000000000000000000",
  "packetId": "packet-product",
  "packetDigest": "0000000000000000000000000000000000000000000000000000000000000000",
  "projectId": "SPTS",
  "taskId": "SPTS-10",
  "repositoryId": "scrum-pi-team-skills",
  "runId": "run-2",
  "baseBranch": "main",
  "baseCommit": "aaaaaaaaaaaaaaaaaaaaaaaaaaaaaaaaaaaaaaaa",
  "baseTree": "bbbbbbbbbbbbbbbbbbbbbbbbbbbbbbbbbbbbbbbb",
  "headBranch": "feature/spts-10",
  "candidateCommit": "cccccccccccccccccccccccccccccccccccccccc",
  "candidateTree": "dddddddddddddddddddddddddddddddddddddddd",
  "role": "product",
  "actorId": "product-1",
  "executionId": "exec-product",
  "workspaceId": "workspace-product",
  "access": "product-control",
  "assurance": "standard",
  "authorityDigest": "aaaaaaaaaaaaaaaaaaaaaaaaaaaaaaaaaaaaaaaaaaaaaaaaaaaaaaaaaaaaaaaa",
  "controllerStateDigest": "bbbbbbbbbbbbbbbbbbbbbbbbbbbbbbbbbbbbbbbbbbbbbbbbbbbbbbbbbbbbbbbb",
  "status": "planned",
  "payload": {
    "kind": "product",
    "outcomeCode": "plan-ready",
    "planDigest": "cccccccccccccccccccccccccccccccccccccccccccccccccccccccccccccccc",
    "taskDefinitions": [
      {
        "taskId": "SPTS-10-S2",
        "objective": "Implement protocol",
        "allowedPaths": ["packages/contracts/"],
        "acceptanceTests": ["quality passes"],
        "dependencies": []
      }
    ]
  }
}
